{
  "$schema": "http://json-schema.org/draft-07/schema#",
  "title": "content/experience.json",
  "type": "object",
  "additionalProperties": false,
  "required": [
    "eyebrow",
    "heading",
    "intro",
    "items"
  ],
  "properties": {
    "$schema": {
      "type": "string"
    },
    "eyebrow": {
      "type": "string",
      "minLength": 1
    },
    "heading": {
      "type": "string",
      "minLength": 1,
      "description": "Text. May use {name}, {email}, {location}, {github}, {linkedin}; *grey phrase*; __gradient__; [label](url)."
    },
    "intro": {
      "type": "string",
      "minLength": 1,
      "description": "Text. May use {name}, {email}, {location}, {github}, {linkedin}; *grey phrase*; __gradient__; [label](url)."
    },
    "items": {
      "type": "array",
      "minItems": 1,
      "items": {
        "type": "object",
        "additionalProperties": false,
        "required": [
          "year",
          "sector",
          "period",
          "title",
          "organisation",
          "text",
          "tags"
        ],
        "properties": {
          "year": {
            "type": "string",
            "minLength": 1
          },
          "sector": {
            "type": "string",
            "minLength": 1
          },
          "period": {
            "type": "string",
            "minLength": 1
          },
          "title": {
            "type": "string",
            "minLength": 1
          },
          "organisation": {
            "type": "string",
            "minLength": 1
          },
          "detail": {
            "type": "string"
          },
          "text": {
            "type": "string",
            "minLength": 1,
            "description": "Text. May use {name}, {email}, {location}, {github}, {linkedin}; *grey phrase*; __gradient__; [label](url)."
          },
          "tags": {
            "type": "array",
            "minItems": 1,
            "items": {
              "type": "object",
              "additionalProperties": false,
              "required": [
                "label"
              ],
              "properties": {
                "label": {
                  "type": "string",
                  "minLength": 1
                },
                "highlight": {
                  "type": "boolean"
                }
              }
            }
          }
        }
      }
    }
  }
}
